{
  "$schema": "https://json-schema.org/draft/2020-12/schema",
  "title": "pixl-crew plugin.json",
  "description": "Plugin manifest for Claude Code plugins",
  "type": "object",
  "required": ["name", "version", "description"],
  "properties": {
    "name": {
      "type": "string",
      "pattern": "^[a-z][a-z0-9-]*$",
      "description": "Plugin name (kebab-case)"
    },
    "version": {
      "type": "string",
      "pattern": "^\\d+\\.\\d+\\.\\d+$",
      "description": "Semantic version (major.minor.patch)"
    },
    "description": {
      "type": "string",
      "minLength": 10,
      "description": "Human-readable plugin description"
    },
    "homepage": {
      "type": "string",
      "format": "uri",
      "description": "Plugin homepage URL"
    },
    "repository": {
      "type": "string",
      "format": "uri",
      "description": "Source repository URL"
    },
    "license": {
      "type": "string",
      "description": "SPDX license identifier"
    },
    "author": {
      "type": "object",
      "properties": {
        "name": { "type": "string" },
        "email": { "type": "string", "format": "email" },
        "url": { "type": "string", "format": "uri" }
      },
      "required": ["name"]
    },
    "keywords": {
      "type": "array",
      "items": { "type": "string" },
      "description": "Search keywords for plugin discovery"
    }
  }
}
