{
  "name": "pixl-crew",
  "version": "11.3.0",
  "description": "Multi-agent development crew: 14 specialized agents, 84 skills, studio templates, and companion plugins (LSP, Trail of Bits security, playground). Full-stack TypeScript, Python, and Swift with DDD patterns, CI/CD pipelines, design extraction, and cross-session memory.",
  "homepage": "https://github.com/hamzaPixl/pixl-ai",
  "repository": "https://github.com/hamzaPixl/pixl-ai",
  "license": "MIT",
  "author": {
    "name": "Hamza Mounir"
  },
  "keywords": [
    "agents",
    "saas",
    "nextjs",
    "fullstack",
    "ddd",
    "scaffolding",
    "crew",
    "multi-agent",
    "orchestration",
    "typescript",
    "shadcn",
    "swift",
    "ios"
  ]
}